{
  "schema_version": "v1",
  "slot_id": "leg_l",
  "role": "limb",
  "required": true,
  "template": "tpl.base.v1.fullbody",
  "template_version": "^1",
  "deformation_parent": "leg_l_warp",
  "category": "body",
  "canvas_px": { "w": 2048, "h": 4096 },
  "uv_box_px": { "x": 704, "y": 2240, "w": 320, "h": 1408 },
  "anchor": {
    "type": "alpha_centroid",
    "x_frac": 0.5,
    "y_frac": 0.1,
    "detect_method": "keypoint_model_body_v1"
  },
  "z_order": 16,
  "visual": {
    "alpha_edge_policy": "feather_2px",
    "line_weight_hint_px": 2.5,
    "color_context": "skin"
  },
  "generation": {
    "prompt_scope": ["leg_shape", "skin_tone", "knee_contour"],
    "negative_prompt": ["face", "arms", "hair", "foot", "background", "text", "watermark"],
    "reference_mask": "masks/leg_l_mask.png",
    "max_iter": 3
  },
  "dependencies": ["hip"],
  "validation": {
    "must_cover_anchor": true,
    "min_alpha_area_frac": 0.04,
    "max_alpha_area_frac": 0.25
  },
  "cubism_part_id": "PartLegL",
  "notes": "캐릭터 왼쪽 다리. leg_l_angle 로 회전, leg_sway_l 로 2차 흔들림. 하단은 foot_l_warp 에서 foot_l 파츠가 이어받음."
}
