{
  "schema_version": "v1",
  "slot_id": "acc_belt",
  "role": "accessory",
  "required": false,
  "template": "tpl.base.v1.fullbody",
  "template_version": "^1",
  "deformation_parent": "acc_belt_warp",
  "category": "accessory",
  "canvas_px": { "w": 2048, "h": 4096 },
  "uv_box_px": { "x": 608, "y": 1920, "w": 832, "h": 128 },
  "anchor": {
    "type": "alpha_centroid",
    "x_frac": 0.5,
    "y_frac": 0.5,
    "detect_method": "keypoint_model_body_v1"
  },
  "z_order": 28,
  "visual": {
    "alpha_edge_policy": "hard",
    "line_weight_hint_px": 1.5,
    "color_context": "accessory"
  },
  "generation": {
    "prompt_scope": ["belt_shape", "buckle", "leather_texture"],
    "negative_prompt": ["face", "hair", "skin", "text", "watermark"],
    "reference_mask": "masks/acc_belt_mask.png",
    "max_iter": 2
  },
  "dependencies": ["hip", "cloth_skirt"],
  "validation": {
    "must_cover_anchor": true,
    "min_alpha_area_frac": 0.005,
    "max_alpha_area_frac": 0.04
  },
  "cubism_part_id": "PartAccBelt",
  "notes": "허리 벨트. acc_belt_warp 는 hip_warp 자식이며 독립 params_in 없음 — hip 이동만 상속. cloth_skirt(z=25) 위에 겹쳐 웨이스트밴드 덮음."
}
