{
  "schema_version": "v1",
  "slot_id": "arm_r_a",
  "role": "arm_r",
  "required": true,
  "template": "tpl.base.v1.fullbody",
  "template_version": "^1.1",
  "deformation_parent": "arm_r_warp",
  "category": "body",
  "canvas_px": { "w": 2048, "h": 2048 },
  "uv_box_px": { "x": 128, "y": 1440, "w": 448, "h": 608 },
  "anchor": {
    "type": "shoulder_r",
    "x_frac": 0.85,
    "y_frac": 0.1,
    "detect_method": "keypoint_model_body_v1"
  },
  "z_order": 22,
  "symmetry": {
    "pair_with": "arm_l_a",
    "mirror_uv": true
  },
  "visual": {
    "alpha_edge_policy": "feather_2px",
    "line_weight_hint_px": 2.5,
    "color_context": "skin"
  },
  "generation": {
    "prompt_scope": ["arm_pose", "skin_tone", "sleeve_style"],
    "negative_prompt": ["face", "torso", "background", "text", "watermark"],
    "reference_mask": "masks/arm_r_a_mask.png",
    "max_iter": 3
  },
  "dependencies": ["torso"],
  "validation": {
    "must_cover_anchor": true,
    "min_alpha_area_frac": 0.10,
    "max_alpha_area_frac": 0.70
  },
  "cubism_part_id": "PartArmRA",
  "notes": "arm_l_a 의 대칭. 중립 포즈."
}
