{
  "schema_version": "v1",
  "slot_id": "eye_white_r",
  "role": "eye_white_r",
  "required": true,
  "template": "tpl.base.v1.halfbody",
  "template_version": "^1",
  "deformation_parent": "eye_r_warp",
  "category": "eye",
  "canvas_px": { "w": 2048, "h": 2048 },
  "uv_box_px": { "x": 768, "y": 720, "w": 240, "h": 160 },
  "anchor": {
    "type": "eye_pupil_center_r",
    "x_frac": 0.5,
    "y_frac": 0.5,
    "detect_method": "keypoint_model_iris_v1"
  },
  "z_order": 74,
  "symmetry": {
    "pair_with": "eye_white_l",
    "mirror_uv": true
  },
  "visual": {
    "alpha_edge_policy": "feather_1px",
    "line_weight_hint_px": 1.0,
    "color_context": "eye"
  },
  "generation": {
    "prompt_scope": ["eye_shape", "white_tone"],
    "negative_prompt": ["face", "hair", "background", "text", "watermark"],
    "reference_mask": "masks/eye_white_r_mask.png",
    "max_iter": 3
  },
  "dependencies": ["face_base"],
  "validation": {
    "must_cover_anchor": true,
    "min_alpha_area_frac": 0.30,
    "max_alpha_area_frac": 0.95
  },
  "cubism_part_id": "PartEyeWhiteR",
  "notes": "eye_white_l 의 대칭. 헤테로크로미아 캐릭터는 symmetry.mirror_uv=false 설정 가능."
}
