{
  "schema_version": "v1",
  "slot_id": "foot_l",
  "role": "limb",
  "required": true,
  "template": "tpl.base.v1.fullbody",
  "template_version": "^1",
  "deformation_parent": "foot_l_warp",
  "category": "body",
  "canvas_px": { "w": 2048, "h": 4096 },
  "uv_box_px": { "x": 672, "y": 3648, "w": 384, "h": 320 },
  "anchor": {
    "type": "alpha_centroid",
    "x_frac": 0.4,
    "y_frac": 0.2,
    "detect_method": "keypoint_model_body_v1"
  },
  "z_order": 14,
  "visual": {
    "alpha_edge_policy": "feather_2px",
    "line_weight_hint_px": 2.5,
    "color_context": "accessory"
  },
  "generation": {
    "prompt_scope": ["foot_shape", "shoe", "ankle_contour"],
    "negative_prompt": ["face", "arms", "hair", "leg_upper", "background", "text", "watermark"],
    "reference_mask": "masks/foot_l_mask.png",
    "max_iter": 3
  },
  "dependencies": ["leg_l"],
  "validation": {
    "must_cover_anchor": true,
    "min_alpha_area_frac": 0.01,
    "max_alpha_area_frac": 0.08
  },
  "cubism_part_id": "PartFootL",
  "notes": "왼발. foot_l_angle 로 발목 회전(정적 pose 전용 — physics_input 아님). leg_l 의 발목 seam 을 덮지 않도록 z=14."
}
